{"type":"config","name":"Reduce live dashboard refresh latency to 200 ms","metricName":"live_recalc_ms","metricUnit":"ms","bestDirection":"lower"}
{"run":1,"commit":"e3824ec","metric":5438.709583,"metrics":{},"status":"keep","description":"baseline for live real-data recalc target using tmp/autoresearch.runtime.html and full unit-test checks; median live /recalc is ~5.44 s with Codex and PI collection dominating","timestamp":1773849799167,"segment":0}
{"run":2,"commit":"e3824ec","metric":1318.534792,"metrics":{},"status":"keep","description":"perf: cache codex session parses by file metadata","timestamp":1773849950149,"segment":0}
{"run":3,"commit":"e3824ec","metric":157.137708,"metrics":{},"status":"keep","description":"perf: cache unchanged provider log parses\n\nPurpose: Reduce repeated live /recalc latency on real local data by reusing parsed results for unchanged Codex, Claude, and PI log files in the long-lived server process.\n\nIncludes:\n- add live-data autoresearch harness and checks writing runtime HTML to tmp/\n- cache Codex session parse results by file size and mtime\n- cache PI session message records by file size and mtime\n- cache Claude request records by file size and mtime\n- update autoresearch notes and ideas backlog","timestamp":1773850467579,"segment":0}
{"type":"config","name":"Reduce live dashboard cold-start recalc latency","metricName":"cold_recalc_ms","metricUnit":"ms","bestDirection":"lower"}
{"run":4,"commit":"9f7f143","metric":5461.125625,"metrics":{},"status":"keep","description":"perf: baseline cold-start recalc latency after warm-cache wins","timestamp":1773851928082,"segment":1}
{"type":"config","name":"Reduce live dashboard restart cold-start recalc latency","metricName":"cold_recalc_ms","metricUnit":"ms","bestDirection":"lower"}
{"run":5,"commit":"9f7f143","metric":221.2255,"metrics":{},"status":"keep","description":"perf: persist provider parse caches across restarts","timestamp":1773852263910,"segment":2}
{"run":6,"commit":"9f7f143","metric":65.441125,"metrics":{},"status":"keep","description":"perf: cache cold-start provider contributions more aggressively","timestamp":1773852672336,"segment":2}
{"run":7,"commit":"9f7f143","metric":66.135625,"metrics":{},"status":"discard","description":"perf: reuse file stat results from directory iteration to avoid redundant stat calls; warm improved slightly but cold median regressed versus 65.44 ms best","timestamp":1773853061733,"segment":2}
{"run":8,"commit":"9f7f143","metric":65.812583,"metrics":{},"status":"discard","description":"perf: lazily export dashboard_core package symbols to cut import overhead; import time dropped materially but cold median still regressed slightly versus 65.44 ms best","timestamp":1773853127084,"segment":2}
{"run":9,"commit":"9f7f143","metric":60.633166,"metrics":{},"status":"keep","description":"perf: cache priced codex file contributions for cold-start rebuilds","timestamp":1773853405512,"segment":2}
{"run":10,"commit":"9f7f143","metric":74.567333,"metrics":{},"status":"discard","description":"perf: cache priced Claude file contributions for cold-start rebuilds; extra serialized contribution shape increased cold latency and regressed well past the 60.63 ms best","timestamp":1773853601729,"segment":2}
{"run":11,"commit":"9f7f143","metric":62.329,"metrics":{},"status":"discard","description":"perf: cache priced PI file contributions for cold-start rebuilds; warm improved slightly but cold median remained worse than the 60.63 ms best","timestamp":1773853774217,"segment":2}
{"run":12,"commit":"9f7f143","metric":0,"metrics":{},"status":"crash","description":"perf: switch persistent cache serialization to pickle-backed binary format; benchmark crashed because the pickle import was missing","timestamp":1773853982961,"segment":2}
{"run":13,"commit":"9f7f143","metric":0,"metrics":{},"status":"crash","description":"perf: switch persistent cache serialization to pickle-backed binary format; fresh-process benchmark crashed because the persistent cache magic constant was missing","timestamp":1773854085014,"segment":2}
{"run":14,"commit":"9f7f143","metric":61.99725,"metrics":{},"status":"discard","description":"perf: switch persistent cache serialization to pickle-backed binary format; restart cold latency stayed worse than the 60.63 ms best despite a smaller faster-loading cache blob","timestamp":1773854145583,"segment":2}
{"run":15,"commit":"9f7f143","metric":67.218333,"metrics":{},"status":"discard","description":"perf: cache Codex aggregate daily/activity totals across restarts; warm improved slightly but cold median regressed versus the 60.63 ms best","timestamp":1773854493439,"segment":2}
{"run":16,"commit":"c0dbb1f","metric":67.05425,"metrics":{},"status":"discard","description":"Measured current live-data restart-cold benchmark while investigating the user's slow browser refresh report; current daemon-side recalc remains fast (~67.1 ms cold, ~45.5 ms warm), so the intermittent multi-second refresh is not reproduced in the benchmark.","timestamp":1776269051238,"segment":2,"confidence":65.6908964883349,"iterationTokens":null}
{"type":"config","name":"Reduce PI append-triggered refresh latency","metricName":"pi_append_parse_ms","metricUnit":"ms","bestDirection":"lower"}
{"run":17,"commit":"c0dbb1f","metric":3380.897375,"metrics":{},"status":"keep","description":"baseline: benchmark PI append-triggered cache invalidation by appending valid usage events to a temp copy of the 925 MiB live PI session; each append currently forces a full reparse at ~3381 ms median","timestamp":1776270594900,"segment":3,"confidence":null,"iterationTokens":5771}
{"run":18,"commit":"c0dbb1f","metric":0.357167,"metrics":{},"status":"keep","description":"perf: resume PI session parsing from the last verified byte offset when a log grows append-only; store verified head/boundary signatures plus parser state in the persistent PI cache so appends to the 925 MiB session no longer trigger a full reparse (~3380.9 ms -> ~0.36 ms median)","timestamp":1776270813096,"segment":3,"confidence":null,"iterationTokens":15084}
{"type":"config","name":"Parallel provider collection for live dashboard recalc","metricName":"cold_recalc_ms","metricUnit":"ms","bestDirection":"lower"}
{"run":19,"commit":"71099da","metric":134.193959,"metrics":{},"status":"keep","description":"baseline: current sequential provider collection after timing diagnostics work; cold live recalc is ~134.2 ms median and warm is ~55.8 ms before testing provider-level parallelism","timestamp":1776288682160,"segment":4,"confidence":null,"iterationTokens":103}
{"run":20,"commit":"71099da","metric":70.100542,"metrics":{},"status":"keep","description":"perf: collect Codex, Claude, and PI usage in parallel after loading persistent caches and before saving them; cold live recalc improved from ~134.2 ms to ~70.1 ms median while warm also edged down to ~52.4 ms","timestamp":1776288724614,"segment":4,"confidence":null,"iterationTokens":1901}
